{
  "$schema": "http://json-schema.org/draft-07/schema#",
  "title": "OHDSI Concept Set",
  "description": "A standardized collection of medical concepts representing a clinical phenomenon",
  "type": "object",
  "required": ["id", "name", "expression"],
  "properties": {
    "id": {
      "type": "integer",
      "description": "Unique identifier for the concept set",
      "minimum": 1
    },
    "name": {
      "type": "string",
      "description": "Human-readable name for the concept set",
      "minLength": 1,
      "maxLength": 255
    },
    "description": {
      "type": ["string", "null"],
      "description": "Optional detailed description of the concept set purpose and contents",
      "maxLength": 4000
    },
    "version": {
      "type": ["string", "null"],
      "description": "Version identifier for the concept set",
      "pattern": "^[0-9]+\\.[0-9]+\\.[0-9]+$"
    },
    "createdBy": {
      "type": ["string", "null"],
      "description": "Username or identifier of the concept set creator",
      "maxLength": 255
    },
    "createdDate": {
      "type": ["string", "null"],
      "description": "ISO 8601 timestamp of concept set creation",
      "format": "date-time"
    },
    "modifiedBy": {
      "type": ["string", "null"],
      "description": "Username or identifier of the last modifier",
      "maxLength": 255
    },
    "modifiedDate": {
      "type": ["string", "null"],
      "description": "ISO 8601 timestamp of last modification",
      "format": "date-time"
    },
    "createdByTool": {
      "type": ["string", "null"],
      "description": "Name and version of the tool used to create the concept set (e.g., 'ATLAS 2.12.0', 'CAPR 4.3', 'Custom Script v1.0')",
      "maxLength": 255
    },
    "modifiedByTool": {
      "type": ["string", "null"],
      "description": "Name and version of the tool used for the last modification (e.g., 'ATLAS 2.12.0', 'CAPR 4.3')",
      "maxLength": 255
    },
    "expression": {
      "type": "object",
      "description": "The logical expression defining which concepts are included",
      "required": ["items"],
      "properties": {
        "items": {
          "type": "array",
          "description": "Array of concept expression items",
          "minItems": 1,
          "items": {
            "$ref": "#/definitions/conceptExpressionItem"
          }
        }
      }
    },
    "tags": {
      "type": ["array", "null"],
      "description": "Optional array of tags for categorization",
      "items": {
        "type": "string",
        "minLength": 1,
        "maxLength": 100
      }
    },
    "metadata": {
      "type": ["object", "null"],
      "description": "Optional additional metadata",
      "additionalProperties": true
    }
  },
  "definitions": {
    "conceptExpressionItem": {
      "type": "object",
      "description": "An individual concept with inclusion/exclusion rules",
      "required": ["concept", "isExcluded", "includeDescendants", "includeMapped"],
      "properties": {
        "concept": {
          "$ref": "#/definitions/concept"
        },
        "isExcluded": {
          "type": "boolean",
          "description": "Whether this concept should be excluded from the set"
        },
        "includeDescendants": {
          "type": "boolean",
          "description": "Whether to include descendant concepts in the hierarchy"
        },
        "includeMapped": {
          "type": "boolean",
          "description": "Whether to include concepts mapped to this concept"
        }
      }
    },
    "concept": {
      "type": "object",
      "description": "A standardized medical concept from OMOP vocabulary",
      "required": ["conceptId"],
      "properties": {
        "conceptId": {
          "type": "integer",
          "description": "Unique OMOP concept identifier",
          "minimum": 0
        },
        "conceptName": {
          "type": ["string", "null"],
          "description": "Human-readable concept name (optional, can be resolved from vocabulary)",
          "minLength": 1,
          "maxLength": 255
        },
        "domainId": {
          "type": ["string", "null"],
          "description": "OMOP domain (optional, can be resolved from vocabulary)",
          "minLength": 1,
          "maxLength": 20
        },
        "vocabularyId": {
          "type": ["string", "null"],
          "description": "Source vocabulary (optional, can be resolved from vocabulary)",
          "minLength": 1,
          "maxLength": 20
        },
        "conceptClassId": {
          "type": ["string", "null"],
          "description": "Classification within the vocabulary (optional, can be resolved from vocabulary)",
          "minLength": 1,
          "maxLength": 20
        },
        "standardConcept": {
          "type": ["string", "null"],
          "description": "Standard concept designation (optional, can be resolved from vocabulary)",
          "enum": ["S", "C", null]
        },
        "conceptCode": {
          "type": ["string", "null"],
          "description": "Original code from source vocabulary (optional, can be resolved from vocabulary)",
          "minLength": 1,
          "maxLength": 50
        },
        "validStartDate": {
          "type": ["string", "null"],
          "description": "Date when concept became valid (optional, can be resolved from vocabulary)",
          "format": "date"
        },
        "validEndDate": {
          "type": ["string", "null"],
          "description": "Date when concept becomes invalid (optional, can be resolved from vocabulary)",
          "format": "date"
        },
        "invalidReason": {
          "type": ["string", "null"],
          "description": "Reason for concept invalidation (optional, can be resolved from vocabulary)",
          "enum": ["D", "U", null]
        }
      }
    }
  },
  "additionalProperties": false
}